{
  "schemaVersion": 1,
  "registryVersion": "1.0.0",
  "legalReviewStatus": "needs-legal-review",
  "features": [
    {"id":"feature.legal.posh.internal-committee-threshold","title":"POSH Internal Committee threshold review","classification":"legal-assurance","domain":"legal","currentRuleRefs":["rule.legal.posh.internal-committee-threshold"],"assessmentFacts":{"available":["fact.workforce.employee-count","fact.footprint.primary-state","fact.footprint.location-count"],"missing":["Feature-specific facts and evidence are incomplete."]},"knowledgeBaseRecords":["CENTRAL-POSH"],"sourcePack":{"status":"complete","registrySourceIds":["posh-act-2013","posh-rules-2013","posh-commencement-2013"],"chunkCatalog":"growwithhr-rag/data/posh-source-chunks.v1.json"},"explanation":{"status":"live","route":"/api/legal-explanation/posh","uiSurface":"analyze-company-v3.html"},"delivery":{"stableReportMutation":false,"stablePdfMutation":false,"stableEmailMutation":false},"legalReviewStatus":"needs-legal-review","readiness":"live-governed","blockers":["The live result remains provisional and needs legal review."],"nextAction":"Retain the governed boundary and add missing facts before any approval claim."},
    {"id":"feature.legal.posh.policy-review","title":"POSH policy review","classification":"legal-assurance","domain":"legal","currentRuleRefs":[],"assessmentFacts":{"available":["fact.workforce.employee-count","fact.footprint.primary-state","fact.footprint.location-count"],"missing":["Feature-specific facts and evidence are incomplete."]},"knowledgeBaseRecords":["CENTRAL-POSH"],"sourcePack":{"status":"partial","registrySourceIds":["posh-act-2013","posh-rules-2013","posh-commencement-2013"],"chunkCatalog":null},"explanation":{"status":"blocked","route":null,"uiSurface":null},"delivery":{"stableReportMutation":false,"stablePdfMutation":false,"stableEmailMutation":false},"legalReviewStatus":"needs-legal-review","readiness":"blocked","blockers":["Required facts, deterministic rule, approved sources, or tests are incomplete."],"nextAction":"Complete facts, rule, sources, retrieval, and boundary tests before activation."},
    {"id":"feature.legal.posh.awareness-training-review","title":"POSH awareness and training review","classification":"legal-assurance","domain":"legal","currentRuleRefs":[],"assessmentFacts":{"available":["fact.workforce.employee-count","fact.footprint.primary-state","fact.footprint.location-count"],"missing":["Feature-specific facts and evidence are incomplete."]},"knowledgeBaseRecords":["CENTRAL-POSH"],"sourcePack":{"status":"partial","registrySourceIds":["posh-act-2013","posh-rules-2013","posh-commencement-2013"],"chunkCatalog":null},"explanation":{"status":"blocked","route":null,"uiSurface":null},"delivery":{"stableReportMutation":false,"stablePdfMutation":false,"stableEmailMutation":false},"legalReviewStatus":"needs-legal-review","readiness":"blocked","blockers":["Required facts, deterministic rule, approved sources, or tests are incomplete."],"nextAction":"Complete facts, rule, sources, retrieval, and boundary tests before activation."},
    {"id":"feature.legal.posh.notice-display-review","title":"POSH notice and display review","classification":"legal-assurance","domain":"legal","currentRuleRefs":[],"assessmentFacts":{"available":["fact.footprint.primary-state","fact.footprint.location-count"],"missing":["Feature-specific facts and evidence are incomplete."]},"knowledgeBaseRecords":["CENTRAL-POSH"],"sourcePack":{"status":"partial","registrySourceIds":["posh-act-2013","posh-rules-2013","posh-commencement-2013"],"chunkCatalog":null},"explanation":{"status":"blocked","route":null,"uiSurface":null},"delivery":{"stableReportMutation":false,"stablePdfMutation":false,"stableEmailMutation":false},"legalReviewStatus":"needs-legal-review","readiness":"blocked","blockers":["Required facts, deterministic rule, approved sources, or tests are incomplete."],"nextAction":"Complete facts, rule, sources, retrieval, and boundary tests before activation."},
    {"id":"feature.legal.posh.complaint-mechanism-records-review","title":"POSH complaint mechanism and records review","classification":"legal-assurance","domain":"legal","currentRuleRefs":[],"assessmentFacts":{"available":["fact.workforce.employee-count","fact.footprint.primary-state","fact.footprint.location-count"],"missing":["Feature-specific facts and evidence are incomplete."]},"knowledgeBaseRecords":["CENTRAL-POSH"],"sourcePack":{"status":"partial","registrySourceIds":["posh-act-2013","posh-rules-2013","posh-commencement-2013"],"chunkCatalog":null},"explanation":{"status":"blocked","route":null,"uiSurface":null},"delivery":{"stableReportMutation":false,"stablePdfMutation":false,"stableEmailMutation":false},"legalReviewStatus":"needs-legal-review","readiness":"blocked","blockers":["Required facts, deterministic rule, approved sources, or tests are incomplete."],"nextAction":"Complete facts, rule, sources, retrieval, and boundary tests before activation."},
    {"id":"feature.legal.posh.internal-committee-composition-unit-review","title":"POSH Internal Committee composition and unit review","classification":"legal-assurance","domain":"legal","currentRuleRefs":[],"assessmentFacts":{"available":["fact.workforce.employee-count","fact.footprint.primary-state","fact.footprint.location-count"],"missing":["Feature-specific facts and evidence are incomplete."]},"knowledgeBaseRecords":["CENTRAL-POSH"],"sourcePack":{"status":"partial","registrySourceIds":["posh-act-2013","posh-rules-2013","posh-commencement-2013"],"chunkCatalog":null},"explanation":{"status":"blocked","route":null,"uiSurface":null},"delivery":{"stableReportMutation":false,"stablePdfMutation":false,"stableEmailMutation":false},"legalReviewStatus":"needs-legal-review","readiness":"blocked","blockers":["Required facts, deterministic rule, approved sources, or tests are incomplete."],"nextAction":"Complete facts, rule, sources, retrieval, and boundary tests before activation."},
    {"id":"feature.legal.posh.annual-reporting-review","title":"POSH annual reporting review","classification":"legal-assurance","domain":"legal","currentRuleRefs":[],"assessmentFacts":{"available":["fact.footprint.primary-state","fact.footprint.location-count"],"missing":["Feature-specific facts and evidence are incomplete."]},"knowledgeBaseRecords":["CENTRAL-POSH"],"sourcePack":{"status":"partial","registrySourceIds":["posh-act-2013","posh-rules-2013","posh-commencement-2013"],"chunkCatalog":null},"explanation":{"status":"blocked","route":null,"uiSurface":null},"delivery":{"stableReportMutation":false,"stablePdfMutation":false,"stableEmailMutation":false},"legalReviewStatus":"needs-legal-review","readiness":"blocked","blockers":["Required facts, deterministic rule, approved sources, or tests are incomplete."],"nextAction":"Complete facts, rule, sources, retrieval, and boundary tests before activation."},
    {"id":"feature.legal.jurisdiction.appropriate-government","title":"Appropriate-government and jurisdiction review","classification":"legal-assurance","domain":"legal","currentRuleRefs":["rule.governance.primary-state.review"],"assessmentFacts":{"available":["fact.footprint.primary-state","fact.footprint.location-count","fact.company.entity-type","fact.company.industry","fact.company.industry-id"],"missing":["Feature-specific facts and evidence are incomplete."]},"knowledgeBaseRecords":["CENTRAL-LABOUR-FRAMEWORK","CENTRAL-CODE-ON-WAGES","CENTRAL-SOCIAL-SECURITY","CENTRAL-OSHWC","CENTRAL-INDUSTRIAL-RELATIONS","STATE-*"],"sourcePack":{"status":"not-started","registrySourceIds":[],"chunkCatalog":null},"explanation":{"status":"blocked","route":null,"uiSurface":null},"delivery":{"stableReportMutation":false,"stablePdfMutation":false,"stableEmailMutation":false},"legalReviewStatus":"needs-legal-review","readiness":"blocked","blockers":["Required facts, deterministic rule, approved sources, or tests are incomplete."],"nextAction":"Complete facts, rule, sources, retrieval, and boundary tests before activation."},
    {"id":"feature.legal.state.shops-establishments","title":"State Shops and Establishments review","classification":"legal-assurance","domain":"legal","currentRuleRefs":["rule.governance.primary-state.review","rule.workplace.multi-location.review"],"assessmentFacts":{"available":["fact.footprint.primary-state","fact.footprint.location-count","fact.workforce.employee-count","fact.company.entity-type","fact.company.industry","fact.footprint.multi-location"],"missing":["Feature-specific facts and evidence are incomplete."]},"knowledgeBaseRecords":["STATE-*"],"sourcePack":{"status":"not-started","registrySourceIds":[],"chunkCatalog":null},"explanation":{"status":"blocked","route":null,"uiSurface":null},"delivery":{"stableReportMutation":false,"stablePdfMutation":false,"stableEmailMutation":false},"legalReviewStatus":"needs-legal-review","readiness":"blocked","blockers":["Required facts, deterministic rule, approved sources, or tests are incomplete."],"nextAction":"Complete facts, rule, sources, retrieval, and boundary tests before activation."},